{
  "format": "sigma-glyph-wave-conformance",
  "format_version": 2,
  "spec_version": "0.7.0",
  "lut_arbiter": "c16701c44851da342f5d1f977ba5284e66dde3abd2c6740b979e39ac1d4d38b2",
  "notes": [
    "interfere() per Book II v0.5 (entropy-coherence coupling adopted).",
    "div_round_half_up is round-half-AWAY-FROM-ZERO (Book II \u00a73).",
    "v0.5.1 (ADR-005, R1): kind=term vectors pin field-level pin completion and absent-wave semantics (expected=null means wave absent); kind=iterate pins repeated self-interference; vectors without kind are raw interfere(w1,w2) as in format_version 1.",
    "expected values computed by impl/sigma_wave.py; regenerate: python3 impl/sigma_wave.py gen"
  ],
  "vectors": [
    {
      "id": "WV-CONSTRUCTIVE",
      "note": "full constructive alignment: order created (delta_en = -256)",
      "w1": {
        "ph": 0,
        "am": 65535,
        "en": 0
      },
      "w2": {
        "ph": 0,
        "am": 65535,
        "en": 0
      },
      "expected": {
        "ph": 0,
        "am": 65535,
        "en": -256
      }
    },
    {
      "id": "WV-ORTHOGONAL",
      "note": "orthogonal: entropy-neutral, amplitude halves",
      "w1": {
        "ph": 0,
        "am": 65535,
        "en": 0
      },
      "w2": {
        "ph": 16384,
        "am": 65535,
        "en": 0
      },
      "expected": {
        "ph": 0,
        "am": 32768,
        "en": 0
      }
    },
    {
      "id": "WV-DESTRUCTIVE",
      "note": "full destructive: disorder created (delta_en = +256), amplitude annihilates",
      "w1": {
        "ph": 0,
        "am": 65535,
        "en": 0
      },
      "w2": {
        "ph": 32768,
        "am": 65535,
        "en": 0
      },
      "expected": {
        "ph": 0,
        "am": 0,
        "en": 256
      }
    },
    {
      "id": "WV-CLAMP-LOW",
      "note": "constructive at minimum entropy: clamp holds, {am=65535,en=-32768} is the fixed point",
      "w1": {
        "ph": 0,
        "am": 65535,
        "en": -32768
      },
      "w2": {
        "ph": 0,
        "am": 65535,
        "en": -32768
      },
      "expected": {
        "ph": 0,
        "am": 65535,
        "en": -32768
      }
    },
    {
      "id": "WV-CLAMP-HIGH",
      "note": "destructive at maximum entropy: clamp holds",
      "w1": {
        "ph": 0,
        "am": 65535,
        "en": 32767
      },
      "w2": {
        "ph": 32768,
        "am": 65535,
        "en": 32767
      },
      "expected": {
        "ph": 0,
        "am": 0,
        "en": 32767
      }
    },
    {
      "id": "WV-SELF-MAX",
      "note": "self-application at max amplitude: phase kept, amplitude stable, entropy drifts -256",
      "w1": {
        "ph": 12345,
        "am": 65535,
        "en": 0
      },
      "w2": {
        "ph": 12345,
        "am": 65535,
        "en": 0
      },
      "expected": {
        "ph": 12345,
        "am": 65535,
        "en": -256
      }
    },
    {
      "id": "WV-SELF-PARTIAL",
      "note": "self-application at 0.75 amplitude: quadratic decay (Resonance Identity, amplitude part)",
      "w1": {
        "ph": 0,
        "am": 49151,
        "en": 0
      },
      "w2": {
        "ph": 0,
        "am": 49151,
        "en": 0
      },
      "expected": {
        "ph": 0,
        "am": 36863,
        "en": -256
      }
    },
    {
      "id": "WV-NEG-TIE",
      "note": "negative odd-sum tie: avg(-1,-2) MUST round away from zero to -2 (Book II \u00a73); floor-division implementations yield -257 instead of -258 here and are NONCONFORMING",
      "w1": {
        "ph": 0,
        "am": 65535,
        "en": -1
      },
      "w2": {
        "ph": 0,
        "am": 65535,
        "en": -2
      },
      "expected": {
        "ph": 0,
        "am": 65535,
        "en": -258
      }
    },
    {
      "id": "WV-LEFT-DOMINANCE",
      "note": "phase is w1's, amplitude and entropy symmetric",
      "w1": {
        "ph": 8192,
        "am": 30000,
        "en": 100
      },
      "w2": {
        "ph": 40960,
        "am": 20000,
        "en": -100
      },
      "expected": {
        "ph": 8192,
        "am": 0,
        "en": 256
      }
    },
    {
      "id": "WV-FALSE-DERIVED",
      "kind": "term",
      "note": "FALSE = APPLY(K,I) with Ph-only pin 49152: am/en derive per R1 -> {49152, 0, -32512}; the normative Book II \u00a76.2 row",
      "term": "FALSE",
      "expected": {
        "ph": 49152,
        "am": 0,
        "en": -32512
      }
    },
    {
      "id": "WV-FALSE-ANCESTOR-SILENT",
      "kind": "term",
      "note": "any APPLY whose derived subtree contains FALSE has am=0: silence propagates, phase coordinates stay visible",
      "term": [
        "APPLY",
        "FALSE",
        "I"
      ],
      "expected": {
        "ph": 49152,
        "am": 0,
        "en": -32640
      }
    },
    {
      "id": "WV-PH-ONLY-ABSENT",
      "kind": "term",
      "note": "Ph-only pin on a non-APPLY leaf: coordinate visible, wave absent (\u00a72.1)",
      "term": "SATOSHI",
      "expected": null
    },
    {
      "id": "WV-UNPINNED-LITERAL-ABSENT",
      "kind": "term",
      "note": "unpinned LITERAL: wave absent (\u00a72.1); absence is not an error",
      "term": {
        "lit": "unpinned"
      },
      "expected": null
    },
    {
      "id": "WV-ITER-DECAY",
      "kind": "iterate",
      "note": "repeated self-interference from partial amplitude decays quadratically to 0 (Book II \u00a75.1); pins the full rounding chain",
      "start": {
        "ph": 0,
        "am": 49151,
        "en": 0
      },
      "expected_am_sequence": [
        49151,
        36863,
        20735,
        6560,
        657,
        7,
        0
      ]
    },
    {
      "id": "WV-COORD-SATOSHI",
      "kind": "coordinate",
      "note": "Ph-only leaf: wave absent (WV-PH-ONLY-ABSENT) but the coordinate stays visible (Book II \u00a72.1/\u00a76.3)",
      "name": "SATOSHI",
      "expected_ph": 8192
    },
    {
      "id": "WV-COORD-V",
      "kind": "coordinate",
      "note": "sector coordinate: shares phase with S (density cluster, not a collision)",
      "name": "V",
      "expected_ph": 16384
    },
    {
      "id": "WV-COORD-FALSE",
      "kind": "coordinate",
      "note": "alias pin coordinate: FALSE ph=49152 regardless of derived am=0",
      "name": "FALSE",
      "expected_ph": 49152
    }
  ]
}
